RODRIGO0308-SQL> ----------------------------------------------------------
RODRIGO0308-SQL> ---------      TRANSACCION 2      ------------------------
RODRIGO0308-SQL> ----------------------------------------------------------
RODRIGO0308-SQL> update prod set cantidad = 100 + (
  2  select cantidad from prod where prod_id = 1002)
  3  where prod_id ;
where prod_id 
             *
ERROR at line 3:
ORA-00920: invalid relational operator 


RODRIGO0308-SQL> edit
Wrote file afiedt.buf

  1  update prod set cantidad = 100 + (
  2  select cantidad from prod where prod_id = 1001)
  3* where prod_id = 1001
RODRIGO0308-SQL> run
  1  update prod set cantidad = 100 + (
  2  select cantidad from prod where prod_id = 1001)
  3* where prod_id = 1001

1 row updated.

RODRIGO0308-SQL> select from * prod;
select from * prod
       *
ERROR at line 1:
ORA-00936: missing expression 


RODRIGO0308-SQL> select * from prod;

   PROD_ID   CANTIDAD                                                           
---------- ----------                                                           
      1001        200                                                           
      1002        500                                                           
      1003        700                                                           
      1004          5                                                           
      1005         12                                                           

RODRIGO0308-SQL> update prod
  2  set cantidad = 100 + (
  3  select cantidad
  4  from prod
  5  where prod_id = 1002)
  6  where prod_id = 1003;

1 row updated.

RODRIGO0308-SQL> select * from prod;

   PROD_ID   CANTIDAD                                                           
---------- ----------                                                           
      1001        200                                                           
      1002        500                                                           
      1003        600                                                           
      1004          5                                                           
      1005         12                                                           

RODRIGO0308-SQL> select * from prod;

   PROD_ID   CANTIDAD                                                           
---------- ----------                                                           
      1001        200                                                           
      1002        500                                                           
      1003        600                                                           
      1004          5                                                           
      1005         12                                                           

RODRIGO0308-SQL> update prod
  2  set cantidad = 100 + (
  3  select cantidad
  4  from prod
  5  where prod_id = 1002)
  6  where prod_id = 1003;

1 row updated.

RODRIGO0308-SQL> select * from prod;

   PROD_ID   CANTIDAD                                                           
---------- ----------                                                           
      1001        200                                                           
      1002        500                                                           
      1003        600                                                           
      1004          5                                                           
      1005         12                                                           

RODRIGO0308-SQL> commit;

Commit complete.

RODRIGO0308-SQL> commit;

Commit complete.

RODRIGO0308-SQL> select * from prod;

   PROD_ID   CANTIDAD                                                           
---------- ----------                                                           
      1001        200                                                           
      1002        500                                                           
      1003        600                                                           
      1004          5                                                           
      1005         12                                                           

RODRIGO0308-SQL> update prod set cantidad = 35 where prod_id = 1001;

1 row updated.

RODRIGO0308-SQL> select * from prod;

   PROD_ID   CANTIDAD                                                           
---------- ----------                                                           
      1001         35                                                           
      1002        500                                                           
      1003        600                                                           
      1004          5                                                           
      1005         12                                                           

RODRIGO0308-SQL> commit;

Commit complete.

RODRIGO0308-SQL> insert into prod values(1006,35);

1 row created.

RODRIGO0308-SQL> select * from prod;

   PROD_ID   CANTIDAD                                                           
---------- ----------                                                           
      1006         35                                                           
      1001         35                                                           
      1002        500                                                           
      1003        600                                                           
      1004          5                                                           
      1005         12                                                           

6 rows selected.

RODRIGO0308-SQL> commit;

Commit complete.

RODRIGO0308-SQL> commit;

Commit complete.

RODRIGO0308-SQL> select * from prod;

   PROD_ID   CANTIDAD                                                           
---------- ----------                                                           
      1001          5                                                           

RODRIGO0308-SQL> update prod set cantidad = 20 where prod_id = 1001;

1 row updated.

RODRIGO0308-SQL> select * from prod;

   PROD_ID   CANTIDAD                                                           
---------- ----------                                                           
      1001         20                                                           

RODRIGO0308-SQL> commit;

Commit complete.

RODRIGO0308-SQL> select * from prod;

   PROD_ID   CANTIDAD                                                           
---------- ----------                                                           
      1001         20                                                           

RODRIGO0308-SQL> update concierto set ocupado=1, nombre='KarinaFuriosa'
  2  where num_asiento=1;

1 row updated.

RODRIGO0308-SQL> select * from prod;

   PROD_ID   CANTIDAD                                                           
---------- ----------                                                           
      1001         20                                                           

RODRIGO0308-SQL> select * from concierto;

NUM_ASIENTO    OCUPADO NOMBRE                                                   
----------- ---------- --------------------                                     
          1          1 KarinaFuriosa                                            
          2          0                                                          
          3          0                                                          

RODRIGO0308-SQL> commit;

Commit complete.

RODRIGO0308-SQL> select * from concierto;

NUM_ASIENTO    OCUPADO NOMBRE                                                   
----------- ---------- --------------------                                     
          1          1 KarinaFuriosa                                            
          2          0                                                          
          3          0                                                          

RODRIGO0308-SQL> commit;

Commit complete.

RODRIGO0308-SQL> select ocupado from concierto where num_asiento=2
  2  for update;

   OCUPADO                                                                      
----------                                                                      
         1                                                                      

RODRIGO0308-SQL> select * from concierto;

NUM_ASIENTO    OCUPADO NOMBRE                                                   
----------- ---------- --------------------                                     
          1          1 KarinaFuriosa                                            
          2          1 pato                                                     
          3          0                                                          

RODRIGO0308-SQL> spool off
